<?xml version="1.0" encoding="euc-jp"?>
<!DOCTYPE class SYSTEM "http://maroontress.com/Sanctuary/1.0/sanctuary.dtd" [
  <!ENTITY thisParam '<param type="struct @ *" name="i"/>'>
]>
<class package="com_example" name="Integer3">
  <namespace/>

  <define name="MAX">
    <macro>0x7fffffff</macro>
  </define>

  <define name="MIN">
    <macro>(-0x7fffffff - 1)</macro>
  </define>

  <typedef type="int" name="t"/>

  <struct tag="@">
    <member type="@_t" name="value"/>
  </struct>

  <method name="new">
    <param type="@_t" name="i"/>
    <return type="struct @ *"/>
  </method>

  <method name="delete">
    &thisParam;
  </method>

  <method name="set">
    &thisParam;
    <param type="@_t" name="value"/>
  </method>

  <method name="get">
    &thisParam;
    <return type="@_t"/>
  </method>
</class>
