<?xml version="1.0" encoding="euc-jp"?>
<!DOCTYPE class SYSTEM "http://maroontress.com/Sanctuary/2.0/sanctuary.dtd">
<class package="com_example" name="Integer2">
  <namespace/>

  <define name="MAX">
    <macro>0x7fffffff</macro>
  </define>

  <define name="MIN">
    <macro>(-0x7fffffff - 1)</macro>
  </define>

  <typedef type="int" name="t"/>

  <struct tag="@">
    <member type="@_t" name="value"/>
  </struct>

  <method name="new">
    <param type="@_t" name="i"/>
    <return type="struct @ *"/>
  </method>

  <method name="delete">
    <param type="struct @ *" name="i"/>
  </method>

  <method name="set">
    <param type="struct @ *" name="i"/>
    <param type="@_t" name="value"/>
  </method>

  <method name="get">
    <param type="struct @ *" name="i"/>
    <return type="@_t"/>
  </method>
</class>
