<?xml version="1.0" encoding="euc-jp"?>
<!DOCTYPE class SYSTEM "http://maroontress.com/Sanctuary/2.0/sanctuary.dtd">
<class package="bar" name="Modifier">
  <namespace/>

  <method name="abort">
    <modifier code="__attribute__((noreturn))"/>
    <desc><brief>コアをダンプして強制終了します。</brief></desc>
  </method>

  <method name="square">
    <param type="int" name="value">
      <desc>整数値</desc>
    </param>

    <modifier code="__attribute__((const))"/>

    <return type="int">
      <desc><arg>value</arg>の自乗の値</desc>
    </return>

    <desc><brief>自乗の値を返します。</brief></desc>
  </method>

  <desc><brief>修飾子の例を提供します。</brief></desc>
</class>
